{
  "$schema": "http://json-schema.org/draft-07/schema#",
  "type": "object",
  "required": ["id", "title", "icon", "color", "version", "subcategories", "cards"],
  "properties": {
    "id": { "type": "string" },
    "title": { "type": "string" },
    "icon": { "type": "string" },
    "color": { "type": "string", "pattern": "^#[0-9A-Fa-f]{6}$" },
    "version": { "type": "integer", "minimum": 1 },
    "subcategories": { "type": "array", "items": { "type": "string" } },
    "cards": {
      "type": "array",
      "items": {
        "type": "object",
        "required": ["id", "question", "answer", "statute", "subcategory", "difficulty"],
        "properties": {
          "id": { "type": "string" },
          "question": { "type": "string", "minLength": 5 },
          "answer": { "type": "string", "minLength": 5 },
          "statute": { "type": "string" },
          "subcategory": { "type": "string" },
          "difficulty": { "type": "integer", "minimum": 1, "maximum": 3 },
          "tags": { "type": "array", "items": { "type": "string" } }
        }
      }
    }
  }
}
